order_id,customer_id,date,nearest_warehouse,shopping_cart,order_price,delivery_charges,customer_lat,customer_long,coupon_discount,order_total,season,is_expedited_delivery,distance_to_nearest_warehouse,latest_customer_review,is_happy_customer
ORD259914,ID1132070452,2/11/2019,Thompson,"[('iStream', 2), ('Toshika 750', 2), ('pearTV', 1)]",15250,71.63,-37.8106761,144.9394491,25,11509.13,Summer,TRUE,0.706,so far a very nice phone i just ordered this and it seems to work great and super fast. i really like it. i went from a note edge which i was in love with to this one. although it's not as wide as the edge it feels nice. and has a great battery life. i will update in a couple days.,TRUE
ORD029077,ID0746912873,2019-13-04,Nickolson,"[('Toshika 750', 1), ('Thunder line', 2)]",8680,69.26,-37.8249298,144.9848718,25,6579.26,Autumn,FALSE,1.5206,nice phone the phone came early but it was clearly used with all the scratches. i enjoy the phone though and it was easy to transfer over to.,TRUE
ORD164810,ID0306968237,6/28/2019,Thompson,"[('Lucent 330S', 1), ('Candle Inferno', 2), ('pearTV', 1)]",8400,65.61,-37.8178034,144.931744,5,8045.61,Winter,TRUE,1.4637,never buy this they said it was new but the item was activate in 2015 when it was having issues i called olivia and they say is not in warranty because i it was activate in 2015 and i bought it in 2017,FALSE
ORD348599,ID0052600129,7/30/2019,Thompson,"[('Alcon 10', 2), ('Thunder line', 2)]",25195,71.11,-37.8020987,144.959614,5,21218.11,Winter,FALSE,1.6134,five stars love this phone.,TRUE
ORD434461,ID0560991981,8/28/2019,Thompson,"[('iStream', 2), ('Olivia x460', 1), ('Alcon 10', 2)]",19425,62.71,-37.8220278,144.9475811,10,17545.21,Winter,TRUE,1.0423,"not in as good of condition as they claimed..... item listed as in ""used - very good condition"" - phone works fine but the camera lens is all scratched up. all pictures come out fuzzy and blurry.... would not have bought it if i knew the camera was not in good functioning condition.......",FALSE
ORD375641,ID0176678055,3/7/2019,Nickolson,"[('Lucent 330S', 2), ('Thunder line', 2), ('pearTV', 2)]",19440,64.49,-37.813073,144.963276,10,17560.49,Autumn,TRUE,0.826,nice options allowing dual usb -c ports and 3.5 mm headphone jack is all i could ask for,TRUE
ORD227108,ID0580001002,8/21/2019,Thompson,"[('Olivia x460', 2), ('Candle Inferno', 2), ('pearTV', 1), ('Toshika 750', 2)]",18260,68.95,144.9309837,-37.8065701,0,18328.95,Winter,FALSE,1.5693,happy with this product i'm happy with the sound system for this phone.,TRUE
ORD263893,ID0054398934,7/6/2019,Thompson,"[('iStream', 1), ('iAssist Line', 1), ('Lucent 330S', 1)]",3605,67.82,-37.8015158,144.9478034,25,2771.57,Summer,FALSE,1.2437,"nice phone looks like new, no problems",TRUE
ORD482916,ID3218293525,10/29/2019,Thompson,"[('Toshika 750', 2), ('Candle Inferno', 2), ('Olivia x460', 2)]",11950,104.34,-37.8027816,144.9473529,25,9066.84,Spring,TRUE,1.1014,oh i love my thunder show and the video news spots,TRUE
ORD234620,ID4391665568,1/5/2019,Nickolson,"[('Candle Inferno', 2), ('Lucent 330S', 2)]",3320,93.58,-37.8124874,144.9632917,25,2583.58,Summer,FALSE,0.8748,"a10 and a20 are amazing beautiful phone, everything i could ask for",TRUE
ORD467625,ID2020813862,6/14/2019,Thompson,"[('Lucent 330S', 2), ('Toshika 750', 2)]",11100,77.65,-37.8115241,144.9592206,15,9512.65,Winter,TRUE,1.2065,exceptional value for money! this was the easiest phone purchase i have ever had phone arrived in like new condition no flaws or imperfections. and cost roughly $700 less than a comparable phone from my carrier. highly recommended,TRUE
ORD473891,ID1131986128,11/22/2019,Thompson,"[('Lucent 330S', 2), ('Thunder line', 2)]",30520,96.81,-37.8149007,144.9450232,5,6575.81,Spring,TRUE,0.3063,good stuff as expected thank you,TRUE
ORD150797,ID0711334297,9/29/2019,Thompson,"[('Candle Inferno', 1), ('Universe Note', 2), ('iAssist Line', 1), ('Toshika 750', 2)]",18195,105.87,-37.8068551,144.9583409,15,15571.62,Spring,TRUE,1.1841,"really like it anything would have been an upgrade from my old phone (universe s1), but i really like this windows operating system and the phone seems to be lighting fast and easy to operate.",TRUE
ORD280119,ID3481124177,2/23/2019,Nickolson,"[('Thunder line', 1), ('Lucent 330S', 2), ('Alcon 10', 1)]",13590,66.56,-37.817906,144.9670943,10,12297.56,Summer,FALSE,0.2292,one of the most important people in my life loves it need i say more this was also a gift for a family member. i spoke with them and they love it it was just what they were looking for and they were very pleased with just about every function of that phone well done,FALSE
ORD133395,ID0541122845,5/18/2019,Bakers,"[('iAssist Line', 1), ('Candle Inferno', 2), ('Olivia x460', 1)]",4310,52.36,-37.8029019,145.0098722,15,3715.86,Autumn,FALSE,1.5105,pos this is complete crap. i spent $400 and it lasted for five months. today it just quit. i just restarted it because my library app sometimes caused it to freeze up. it never turned back on. it's a $400 paperweight.,FALSE
ORD278551,ID0781137278,7/27/2019,Thompson,"[('Lucent 330S', 2), ('Olivia x460', 2), ('Alcon 10', 1), ('iStream', 2)]",12570,66.47,-37.8029384,144.9483515,10,11379.47,Winter,FALSE,1.0895,"really good phone i upgraded from the honor 6x to this mate 20 lite and it looks awesome and it moves really good. pretty happy with the purchase, the only thing that could be better it's the battery life.",TRUE
ORD149944,ID6202471347,4/28/2019,Nickolson,"[('pearTV', 2), ('Alcon 10', 2)]",30520,80.51,-37.8224318,144.9790292,0,30600.51,Autumn,TRUE,0.9365,"good afternoon, please i have a problem with the ... good afternoon, please i have a problem with the phone, there is a problem with the phone bluethoo does not work and with the speaker, because i do not listen to talk. the other apps work fine, i could do with this problem. thank you.",TRUE
ORD061928,ID0589450468,2/3/2019,Nickolson,"[('Universe Note', 1), ('iAssist Line', 2), ('Olivia x460', 1)]",9125,79.27,-37.8097201,144.9723055,15,7835.52,Autumn,TRUE,1.0172,five stars perfect for my 60 year old father.,TRUE
ORD254947,ID2696446375,3/14/2019,Bakers,"[('pearTV', 1), ('Universe Note', 1)]",9760,78.36,-37.8117628,144.985371,5,9350.36,Autumn,TRUE,0.8892,just great came on time works great,TRUE
ORD335034,ID4294474624,10/3/2019,Nickolson,"[('Alcon 10', 2), ('Thunder line', 2), ('Lucent 330S', 2), ('iAssist Line', 1)]",26945,107.02,-37.805401,144.9737077,0,27052.02,Spring,TRUE,1.5135,no problems came on time and it works perfectly,TRUE
ORD387155,ID0248969197,3/18/2019,Bakers,"[('Olivia x460', 1), ('Toshika 750', 2)]",9865,65.96,-37.7998186,144.9927729,15,8451.21,Autumn,TRUE,1.1534,"nice phone but it's deteriorating quickly i really liked the phone but now eight months later the fingerprint sensor no longer works, the back of the case is cracked (i don't know how), and the cell phone reception is getting worse and worse. the camera is also not very good.",FALSE
ORD007698,ID2133326031,4/8/2019,Nickolson,"[('Universe Note', 2), ('Lucent 330S', 2)]",9360,66.4,-37.8059887,144.9736895,10,8490.4,Autumn,FALSE,1.4497,"nice basic phone my mother-in-law does not like technology, so this phone was perfect for her. replaced an old lg flip-phone and has worked great!",FALSE
ORD334012,ID3212024930,12/20/2019,thompson,"[('Toshika 750', 1), ('pearTV', 2), ('iStream', 2)]",17240,76.77,-37.8072788,144.9486081,25,13006.77,Summer,TRUE,0.6156,"won’t work with verizon us even though it says it works with verizon, verizon said it’s an international phone and won’t work with their system. i spent 5+ hours on the phone with them. waste of time and a huge waste of money.",FALSE
ORD427893,ID2441346320,2/23/2019,Bakers,"[('Lucent 330S', 1), ('Olivia x460', 1), ('iStream', 2), ('iAssist Line', 1)]",4980,96.89,-37.804722,144.9840992,15,4329.89,Summer,TRUE,1.1416,"so nice phone, incredible price thanks xiaomi great phone for awesome price",TRUE
ORD315910,ID2810279736,12/26/2019,Bakers,"[('iStream', 2), ('Olivia x460', 1), ('iAssist Line', 1)]",3750,74.25,144.9879601,-37.8168503,5,3636.75,Summer,FALSE,0.9955,new xp 6 phone although the phone was delivered a day late and the package was open the phone is ok. every thing that was advertised.,TRUE
ORD320685,ID0343337611,11/7/2019,Nickolson,"[('Universe Note', 1), ('iAssist Line', 1), ('Toshika 750', 1), ('Alcon 10', 1)]",18945,87.07,-37.799465,144.9682706,15,16190.32,Spring,FALSE,2.1325,very satisfied the phone was for my son. it looks and performs like new!,TRUE
ORD456753,ID0260907401,9/14/2019,bakers,"[('Alcon 10', 2), ('pearTV', 1), ('Toshika 750', 1), ('Lucent 330S', 2)]",30990,114.35,-37.8249302,145.0119503,0,31104.35,Spring,TRUE,2.2192,outstanding device for value battery life is limited but the entire device is excellent.,TRUE
ORD106947,ID4418536076,3/27/2019,Thompson,"[('Universe Note', 1), ('Thunder line', 2), ('pearTV', 2), ('iStream', 1)]",20580,52.08,-37.8024904,144.9634374,5,19603.08,Autumn,TRUE,1.8323,do not buy from wireless place bad choice. camera is blurry. it's a used phone or its defective and the seller did not say anything even after i sent them a message.,FALSE
ORD301495,ID4157116177,10/5/2019,Bakers,"[('Universe Note', 2), ('Toshika 750', 2)]",13980,78.18,-37.818184,144.9956959,10,14064.18,Spring,FALSE,0.9124,five stars good a pure android phone,TRUE
ORD158407,ID0575387776,4/29/2019,Nickolson,"[('Lucent 330S', 1), ('Alcon 10', 1), ('Universe Note', 2), ('Olivia x460', 2)]",19530,80.33,-37.8196346,144.9849957,5,18633.83,Autumn,TRUE,1.3631,good phone however i didn't realize you can't insert a ... good phone however i didn't realize you can't insert a sd card to expand the memory. i'll be sure to look for that next time i buy a phone.,FALSE
ORD117307,ID2384091375,7/19/2019,Nickolson,"[('iStream', 2), ('Toshika 750', 1)]",4620,79.39,-37.807709,144.9732063,5,4468.39,Winter,TRUE,1.2537,"quick delivery and in perfect condition ! received exactly the item described. with nice packaging, charging cord, and a sim card. works great on sprint.",FALSE
ORD438253,ID0746909543,9/18/2019,Bakers,"[('Toshika 750', 1), ('iStream', 2), ('Thunder line', 2)]",8980,114.19,-37.8227361,145.0152576,5,8645.19,Spring,TRUE,2.2611,"bright screen, lightweight, great price, i love it!",TRUE
ORD452170,ID0356125397,4/21/2019,Nickolson,"[('Alcon 10', 1), ('Universe Note', 1), ('Thunder line', 2), ('Candle Inferno', 1)]",17190,65.26,-37.8179472,144.9799201,0,17255.26,Autumn,FALSE,0.9147,good experience good product almost look like new i'm satisfied,TRUE
ORD056265,ID0387266357,9/15/2019,Thompson,"[('pearTV', 2), ('iStream', 1), ('Candle Inferno', 1), ('Toshika 750', 2)]",21840,77.48,-37.8103955,144.9556369,0,21917.48,Spring,FALSE,0.795,"four stars works great - i don't need or want a more ""involved"" phone",TRUE
ORD313537,ID0576856945,3/1/2019,Bakers,"[('iStream', 1), ('pearTV', 2)]",12770,83.84,-37.8246414,144.9885739,5,12215.34,Autumn,FALSE,1.7322,works great! i sure wish they made this for metropcs ... top rated phone! works great! i sure wish they made this for metropcs users! it really is an amazing phone!,TRUE
ORD408385,ID0267317935,11/8/2019,Nickolson,"[('iAssist Line', 2), ('Universe Note', 1), ('Toshika 750', 2), ('Lucent 330S', 1)]",25490,104.85,-37.8226066,144.9579795,15,21771.35,Spring,TRUE,1.1112,"nice upgrade from an s4 works as expected, fast and light",TRUE
ORD284623,ID6167413242,2/5/2019,Nickolson,"[('iAssist Line', 1), ('pearTV', 2)]",14845,94.59,-37.8115054,144.9729388,25,11228.34,Summer,TRUE,0.8436,"perfect, came early too! came with 100% battery health (battery was new), packaged well, and came early. after around 5 hours of use everything seems to be working well. also came with a 90 day warranty.",TRUE
ORD342852,ID0370243926,3/7/2019,Nickolson,"[('Universe Note', 1), ('Lucent 330S', 1)]",4680,84.43,-37.801495,144.9675869,15,4062.43,Autumn,TRUE,1.9113,"five stars just what i wanted, everything is hunky dory thank you",TRUE
ORD099089,ID0176679719,2019-17-04,Nickolson,"[('Thunder line', 1), ('Toshika 750', 1), ('iAssist Line', 1), ('Lucent 330S', 1)]",9955,50.62,-37.812627,144.9627742,10,9010.12,Autumn,FALSE,0.8925,false advertising the seller advertised the product as unlocked but it is not! don't waste your time and money!,FALSE
ORD324605,ID0248746937,11/1/2019,Bakers,"[('Thunder line', 1), ('Olivia x460', 1), ('Lucent 330S', 1), ('iAssist Line', 2)]",9085,108.16,144.9928374,-37.825097,15,7830.41,Spring,TRUE,1.6941,"big, beautiful and sleek i love my phone- it's been a few days with it, and it's a little bigger than comfortable but i love it very much. very high quality, beautiful and sleek.",TRUE
ORD149536,ID3144992717,8/19/2019,Bakers,"[('Alcon 10', 1), ('Thunder line', 2), ('pearTV', 1), ('Candle Inferno', 2)]",20480,65.05,-37.8141396,144.9888458,0,20545.05,Winter,FALSE,0.7268,so far so good i am very pleased with this phone. my vehicle has sync and this phone is one of the few that is totally compatible with my ride. awesome!,TRUE
ORD367185,ID0207076045,11/16/2019,Nickolson,"[('Universe Note', 1), ('Alcon 10', 2), ('Toshika 750', 2)]",29990,116.71,-37.8332672,144.9912618,5,28607.21,Spring,TRUE,2.5123,bought as a gift i used to have a note and loved it. i bought this as a gift and can't really can't give a quality review and explains the 4 stars. my girlfriend say's she hasn't had any issues though.,TRUE
ORD228657,ID5421990706,5/20/2019,Thompson,"[('Olivia x460', 1), ('Alcon 10', 1), ('iAssist Line', 1)]",12400,50.85,-37.8039087,144.957357,25,9350.85,Autumn,FALSE,1.1727,got a faulty phone. waste of time. though it says as certified refurbished but got a phone which has dead pixels and also flickering screen at the bottom.,FALSE
ORD475121,ID0452380690,5/15/2019,Thompson,"[('Alcon 10', 1), ('Thunder line', 2), ('iAssist Line', 1)]",15535,67.32,-37.825603,144.9513867,15,13272.07,Autumn,FALSE,1.4885,i recomended great phone,TRUE
ORD395862,ID0207078682,12/9/2019,Bakers,"[('Lucent 330S', 2), ('Olivia x460', 2), ('pearTV', 1), ('Toshika 750', 2)]",19860,88.68,-37.8238884,145.0159157,25,10863.28,Summer,FALSE,2.3874,"this is an awesome phone! awesome phone! finally windows is coming through with useful, read to use products! solid, great feel in the hand, battery is longer than my universe 3 ""with a few tweaks"".",TRUE
ORD102586,ID4716795834,7/25/2019,Thompson,"[('iAssist Line', 1), ('pearTV', 1), ('Lucent 330S', 1)]",9765,76.95,-37.8187257,144.9535504,5,12760.54,Winter,TRUE,0.8825,"five stars this is a great phone, i prefer windows over pear or android. great camera, great screen, great price.",TRUE
ORD494548,ID2069604226,12/10/2019,Bakers,"[('iAssist Line', 1), ('Toshika 750', 1), ('Universe Note', 2), ('Alcon 10', 2)]",31345,68.29,-37.8010327,144.9791761,10,28278.79,Spring,FALSE,1.7291,"not as advertised the ear speaker did not have full volume and could hardly hear any of my phone calls. the screen was slightly cracked when it arrived. also, it would not hold phone service and my phone kept going in and out of service and wouldn’t read my sim card",FALSE
ORD452928,ID0145191754,7/3/2019,Thompson,"[('Universe Note', 2), ('iAssist Line', 2), ('Candle Inferno', 2)]",12210,49.69,-37.8183985,144.9544799,10,11038.69,Winter,FALSE,0.9115,one star it just stopped working. returned it and upgraded to alconx with no regrets.,FALSE
ORD193880,ID5001030330,2/24/2019,Thompson,"[('Toshika 750', 1), ('Olivia x460', 2), ('pearTV', 2), ('Candle Inferno', 1)]",19820,54.28,-37.8114653,144.9528619,5,18883.28,Summer,TRUE,0.5269,"the camera is not very sharp , and you can not download another one .",FALSE
ORD016081,ID3212024917,10/17/2019,Thompson,"[('Candle Inferno', 2), ('pearTV', 2), ('iStream', 2)]",13780,99.69,-37.808466,144.9480456,0,13879.69,Spring,TRUE,0.4761,five stars works great feels great and great for gaming,TRUE
ORD246314,ID0846571201,3/6/2019,Nickolson,"[('Olivia x460', 1), ('pearTV', 1), ('iAssist Line', 2), ('Candle Inferno', 2)]",12845,61.18,144.9688448,-37.8184296,0,12906.18,Autumn,TRUE,0.0648,worst phone i've ever had worst phone i've ever had. first of all verizon never got me a $100 rebate.: after 3 hours on the phone i gave up. every time i re-boot the phone the bluetooth is off. never buying again.,FALSE
ORD410633,ID0577396644,12/24/2019,Nickolson,"[('iAssist Line', 1), ('pearTV', 2), ('Toshika 750', 1)]",19165,73.78,-37.8193848,144.9798169,15,16364.03,Summer,FALSE,0.907,"very happy great phone i had the j7 it was a lil easier to use. but its still a goid phone and i recommend it if your looking for a boist or virgin mobel, or sprint phone wo paying hundreds of dollers.",FALSE
ORD102975,ID1838361789,3/19/2019,Nickolson,"[('iStream', 2), ('Candle Inferno', 2)]",1160,66.86,-37.8114892,144.9647681,0,1226.86,Autumn,FALSE,0.8959,"i'm loving it previous alcon user-no regrets switching to universe s4. so classy n awesome. lots of freebies n unlimited options. bttery life no problem i have charger in my bedroom, car, work etc plenty.",TRUE
ORD233215,ID4315299525,3/7/2019,Bakers,"[('Universe Note', 1), ('Olivia x460', 1)]",4675,80.87,-37.8193114,144.9939879,25,3587.12,Autumn,TRUE,1.0427,"good good condition, came with charger & ear buds",FALSE
ORD467213,ID0163654119,2/21/2019,Nickolson,"[('Toshika 750', 1), ('pearTV', 1), ('iAssist Line', 2), ('Lucent 330S', 1)]",16310,71.54,-37.8197635,144.9743772,25,12304.04,Summer,FALSE,0.4439,best phone for the money love my phone.,TRUE
ORD039987,ID0356089311,9/13/2019,Bakers,"[('Lucent 330S', 2), ('iAssist Line', 1), ('Toshika 750', 1), ('pearTV', 1)]",15315,78.02,-37.8177738,144.9969973,10,13861.52,Spring,FALSE,0.8173,i can you my phone for business.... i like everything about the phone good product for the money.,TRUE
ORD349027,ID2441346320,1/9/2019,thompson,"[('pearTV', 1), ('Alcon 10', 2), ('iStream', 2)]",24510,81.85,-37.804722,144.9840992,5,23366.35,Summer,TRUE,1.1416,"missing items and damaged items missing micro 64 gb sim card, demaged case",FALSE
ORD491050,ID6167417885,8/2/2019,thompson,"[('Thunder line', 1), ('Toshika 750', 2)]",10820,66.91,-37.8164835,144.9558359,10,9804.91,Winter,FALSE,0.8799,"completely satisfied! needed a phone right away. this was a convenient, quick and easy transaction. completely satisfied and will use this option more often from now on!",TRUE
ORD217705,ID2621587187,9/27/2019,Bakers,"[('Alcon 10', 2), ('Toshika 750', 2), ('Lucent 330S', 1), ('Olivia x460', 1)]",28995,80.53,-37.8069839,145.0106199,10,26176.03,Spring,FALSE,1.3943,"good value good phone, wrap screen is nice. wish it was little bigger.",TRUE
ORD368076,ID6167440987,4/29/2019,Nickolson,"[('Toshika 750', 1), ('Lucent 330S', 2), ('pearTV', 1)]",13090,65.27,-37.8133626,144.962603,25,9882.77,Autumn,FALSE,0.8441,great value for money. it arrived as expected and was in mint condition. i am very pleased.,TRUE
ORD422879,ID0746908734,7/12/2019,Bakers,"[('Olivia x460', 1), ('Lucent 330S', 2), ('Alcon 10', 1), ('iAssist Line', 1)]",14860,70.52,-37.8218441,145.0153367,10,13444.52,Winter,TRUE,2.2057,"quality for money, depends what you expect to get quality of photos were not so good. it says 40 mega pixels but when zooming in i found it pixelated and color changed on edges.",FALSE
ORD481727,ID0364845726,3/15/2019,Bakers,"[('Universe Note', 2), ('iAssist Line', 1), ('Olivia x460', 1)]",10350,67.88,-37.801387,144.9806043,0,10417.88,Autumn,FALSE,1.6042,the thunder is wonderful but i'm still learning how to use it. music requests are somewhat limited.,TRUE
ORD267860,ID6167344579,7/16/2019,Nickolson,"[('pearTV', 1), ('Thunder line', 1), ('Lucent 330S', 1), ('Candle Inferno', 2)]",10580,61.15,144.9725812,-37.816032,5,10112.15,Winter,FALSE,0.3904,five stars okay,TRUE
ORD212807,ID4716795789,6/26/2019,Thompson,"[('pearTV', 2), ('Universe Note', 1), ('Thunder line', 1), ('Alcon 10', 2)]",24435,49.56,-37.8174371,144.9526442,0,36199.56,Winter,FALSE,0.7222,"this is an updated post. there is something seriously ... this is an updated post. there is something seriously wrong with this phone. the regular speaker on the phone works only intermittently, and only very rarely. i'm not sure if it is a hardware problem with the speaker itself or something deeper, but it is not usable.",FALSE
ORD080311,ID6237549287,10/31/2019,Bakers,"[('Thunder line', 1), ('iStream', 1), ('pearTV', 2), ('Universe Note', 2)]",21850,106.28,-37.8013687,145.0046832,10,19771.28,summer,TRUE,1.2702,not a verizon phone. phone looked good but was listed as verizon but was a tmobile so returned it.,TRUE
ORD197277,ID3085953531,3/31/2019,nickolson,"[('iAssist Line', 1), ('Thunder line', 1)]",4405,49.84,-37.8161657,144.9752775,25,3353.59,Autumn,FALSE,0.5716,hate it first the phone was locked while the description said unlocked second i gifted this phone to someone . the phone started to go on sleep every 5 minutes. i had terrible experience shopping here specially with this seller. never recommend to anybody return window also expired as i givfted 2 months later in some other country.,FALSE
ORD096722,ID2481930530,10/11/2019,Bakers,"[('iAssist Line', 1), ('Universe Note', 1), ('pearTV', 1)]",11985,84.45,-37.8054701,144.9972895,10,10870.95,Autumn,TRUE,0.5353,beware!!! very disappointed. phone was a model no longer sold due to an irreparable software issue that pear would give a warranty for had it been purchased there. waste of time without a phone twice. two thumbs down on this one.,FALSE
ORD142140,ID5002594976,6/26/2019,Thompson,"[('Candle Inferno', 2), ('iStream', 1)]",1010,74.64,-37.811959,144.951797,0,1084.64,Winter,TRUE,0.4233,great! excellent,TRUE
ORD492772,ID3281123467,11/11/2019,Thompson,"[('Lucent 330S', 1), ('Alcon 10', 1)]",10180,79.13,-37.8051431,144.9573951,5,9750.13,Spring,FALSE,1.2359,great buy phone in amazing condition. very happy.,TRUE
ORD297515,ID0418549442,10/3/2019,Nickolson,"[('Olivia x460', 2), ('iStream', 2), ('Toshika 750', 1)]",7070,81.22,-37.8214149,144.9849781,25,5383.72,Spring,TRUE,1.3924,my smartphone upgrade. this is a great phone. i go it on an upgrade with my carrier. i love this phone and would recommend it to anyone who wants an excellent smartphone.,TRUE
ORD366253,ID1093410280,9/30/2019,Bakers,"[('Thunder line', 1), ('Toshika 750', 2)]",8790,76.66,-37.806396,145.0038798,15,7548.16,Spring,FALSE,0.8597,perfect for my kid it's great for my son! battery lasts for all week.,TRUE
ORD158940,ID0579504501,3/20/2019,Thompson,"[('Olivia x460', 2), ('pearTV', 1)]",6610,78.73,-37.8139487,144.949348,5,6358.23,Autumn,TRUE,0.2456,"this is my first smart phone, so there was and is a learning ... this is my first smart phone, so there was and is a learning curve, but i have to say this a great phone, for the money it does everything except tie your shoes for you. i am saving a lot of money by not leasing an alcon or universe!",TRUE
ORD216693,ID1668523020,11/7/2019,Thompson,"[('Universe Note', 1), ('Lucent 330S', 2), ('iStream', 2)]",6210,101.96,-37.8082365,144.9421811,0,6311.96,Spring,TRUE,0.6547,it is what i expected it is what expected! i am happy with my purchase.,TRUE
ORD452128,ID1449266842,3/14/2019,Bakers,"[('Candle Inferno', 2), ('Alcon 10', 1), ('iStream', 1), ('iAssist Line', 2)]",14410,65.05,-37.816648,144.983918,10,13034.05,Autumn,TRUE,0.9971,not good not good,FALSE
ORD495376,ID1463620803,3/27/2019,Bakers,"[('Alcon 10', 1), ('pearTV', 1)]",15260,64.78,-37.8175697,145.0052208,5,14561.78,Autumn,FALSE,1.2175,five stars perfect! and arrived sooner than expected!,TRUE
ORD121534,ID4893634398,3/23/2019,Thompson,"[('pearTV', 1), ('Alcon 10', 2), ('Thunder line', 2)]",28570,69.83,-37.8096704,144.9261939,0,9171.66,Autumn,FALSE,1.866,"best smartphone 2017 best of the best smartphone i ever had, impressive design & features. toshika win this of all smartphone try it you dont regret it its worth for your money. luv this phone.",TRUE
ORD433660,ID0245531251,9/17/2019,Nickolson,"[('Toshika 750', 1), ('pearTV', 2), ('Alcon 10', 1)]",25890,75.41,-37.8123861,144.9656484,0,25965.41,Spring,FALSE,0.7717,very fun to use and having morning briefing,TRUE
ORD168905,ID1879021169,5/28/2019,Nickolson,"[('iStream', 1), ('Thunder line', 2)]",4510,67.19,-37.8106434,144.9791414,5,4351.69,Autumn,FALSE,1.2226,wowed there were no scratches. better than expected,TRUE
ORD398227,ID0257505381,9/4/2019,Thompson,"[('Alcon 10', 1), ('pearTV', 2), ('Lucent 330S', 1)]",22800,87.54,-37.7989401,144.9629875,0,22887.54,Spring,FALSE,2.073,great service by just as advertised. great service by seller,TRUE
ORD218231,ID4162427921,1/7/2019,Nickolson,"[('pearTV', 2), ('iStream', 1), ('Universe Note', 2)]",13640,87.83,-37.8197057,144.9706935,0,19757.83,Summer,TRUE,0.1593,nice bought it for my girl and she loves it.,TRUE
ORD422882,ID0541122845,2/8/2019,Bakers,"[('iStream', 1), ('Lucent 330S', 1)]",1380,101.02,-37.8029019,145.0098722,0,20545.05,Summer,TRUE,1.5105,"better than expected bought for 13 year old, he really likes it. battery life is much better than expected. had 50% battery left after 10 hours at dollywood.",TRUE
ORD208762,ID2207661117,1/8/2019,Thompson,"[('iStream', 1), ('Olivia x460', 2), ('Alcon 10', 2)]",20500,79.52,-37.8005335,144.9458871,0,20579.52,Summer,FALSE,1.3553,love it i love my phone and it for everything.,FALSE
ORD206745,ID2188399791,3/7/2019,Nickolson,"[('Lucent 330S', 1), ('iAssist Line', 1), ('pearTV', 1), ('Alcon 10', 1)]",18715,78.05,-37.8120349,144.9706416,15,15985.8,Autumn,FALSE,0.7365,five stars i got than i expect it's very good everything i order from digico is nice,TRUE
ORD156626,ID2189145409,3/12/2019,Thompson,"[('Alcon 10', 1), ('iAssist Line', 1), ('pearTV', 2), ('Olivia x460', 1)]",25020,80.49,-37.8106426,144.9560066,25,18845.49,Autumn,FALSE,0.8179,five stars very happy with product and seller.,TRUE
